{
  "conditions": {
    "applications": {
      "excludeApplications": [],
      "includeApplications": [
        "All"
      ],
      "includeAuthenticationContextClassReferences": [],
      "includeUserActions": []
    },
    "clientAppTypes": [
      "exchangeActiveSync",
      "other"
    ],
    "servicePrincipalRiskLevels": [],
    "signInRiskLevels": [],
    "userRiskLevels": [],
    "users": {
      "excludeGroups": [],
      "excludeRoles": [],
      "excludeUsers": [],
      "includeGroups": [],
      "includeRoles": [],
      "includeUsers": [
        "All"
      ]
    }
  },
  "displayName": "CAP001 | Global | IdentityProtection | AllApps | AnyPlatform | BLOCK | Legacy Authentication",
  "grantControls": {
    "builtInControls": [
      "block"
    ],
    "customAuthenticationFactors": [],
    "operator": "OR",
    "termsOfUse": []
  },
  "state": "disabled"
}
